<?xml version="1.0" encoding="UTF-8"?>
<!DOCTYPE list SYSTEM "skill.dtd">
<list>
	<skill id="23234" levels="1" name="Singer &amp; Dancer Agathion Cute Trick">
		<set name="icon" value="icon.skill_agathion_cute"/>
		<set name="hitTime" value="3000"/>
		<set name="ride_state" value="NONE;STRIDER;WYVERN;WOLF"/>
		<set name="magicLevel" value="85"/>
		<set name="magicType" value="SPECIAL"/>
		<set name="target" value="TARGET_SELF"/>
		<set name="skillType" value="BUFF"/>
		<set name="operate_type" value="A2"/>
		<set name="isReuseDelayPermanent" value="true"/>
		<cond msgId="2292">
			<player agathion="-1"/>
		</cond>
	</skill>
	<skill id="23298" levels="1" name="Flame Hawk">
		<set name="debuff" value="true"/>
		<set name="icon" value="icon.skill0771"/>
		<set name="abnormal_effect" value="DOT_BLEEDING"/>
		<set name="abnormal_time" value="10"/>
		<set name="abnormal_level" value="1"/>
		<set name="abnormal_type" value="dot_attr"/>
		<set name="magicLevel" value="83"/>
		<set name="lv_bonus_rate" value="1"/>
		<set name="target" value="TARGET_ONE"/>
		<set name="skillType" value="DEBUFF"/>
		<set name="operate_type" value="A2"/>
		<for>
			<effect name="t_hp" interval="1" value="-150"/>
		</for>
	</skill>
	<skill id="23299" levels="1" name="Arrow Rain">
		<set name="debuff" value="true"/>
		<set name="effectPoint" value="100"/>
		<set name="icon" value="icon.skill0772"/>
		<set name="abnormal_effect" value="DOT_BLEEDING"/>
		<set name="abnormal_time" value="10"/>
		<set name="abnormal_level" value="1"/>
		<set name="abnormal_type" value="dot_attr"/>
		<set name="magicLevel" value="83"/>
		<set name="lv_bonus_rate" value="1"/>
		<set name="target" value="TARGET_ONE"/>
		<set name="skillType" value="DEBUFF"/>
		<set name="operate_type" value="A2"/>
		<for>
			<effect name="t_hp" interval="1" value="-150"/>
		</for>
	</skill>
</list>