<?xml version="1.0" encoding="UTF-8"?>
<!DOCTYPE list SYSTEM "skill.dtd">
<list>
	<skill id="56000" levels="1" name="Stable Scroll: Enchant Cloak">
		<set name="icon" value="icon.skill0000"/>
		<set name="target" value="TARGET_NONE"/>
		<set name="skillType" value="NOTUSED"/>
		<set name="operate_type" value="P"/>
	</skill>
	<skill id="56001" levels="1" name="High-grade Life Stone Pack - Legendary">
		<set name="icon" value="icon.skill0000"/>
		<set name="coolTime" value="500"/>
		<set name="hitTime" value="500"/>
		<set name="target" value="TARGET_NONE"/>
		<set name="skillType" value="NOTUSED"/>
		<set name="operate_type" value="P"/>
	</skill>
	<skill id="56002" levels="1" name="High-grade Life Stone Pack - Cloak">
		<set name="icon" value="icon.skill0000"/>
		<set name="coolTime" value="500"/>
		<set name="hitTime" value="500"/>
		<set name="target" value="TARGET_NONE"/>
		<set name="skillType" value="NOTUSED"/>
		<set name="operate_type" value="P"/>
	</skill>
	<skill id="56003" levels="1" name="XP &amp; SP Rune - 50%">
		<set name="icon" value="icon.skill19226"/>
		<set name="target" value="TARGET_NONE"/>
		<set name="skillType" value="NOTUSED"/>
		<set name="operate_type" value="P"/>
	</skill>
	<skill id="56004" levels="1" name="Summon Agathion - Mermaid">
		<set name="icon" value="icon.etc_summon_aga_agit_i00"/>
		<set name="hitTime" value="3000"/>
		<set name="target" value="TARGET_NONE"/>
		<set name="skillType" value="NOTUSED"/>
		<set name="operate_type" value="P"/>
	</skill>
	<skill id="56005" levels="1" name="Agathion Mermaid Enchant Scroll">
		<set name="icon" value="icon.star_scrl_of_ench_ag"/>
		<set name="target" value="TARGET_NONE"/>
		<set name="skillType" value="NOTUSED"/>
		<set name="operate_type" value="P"/>
	</skill>
	<skill id="56006" levels="1" name="Master\'s Fishing Potion">
		<set name="icon" value="BranchIcon.etc_sign_agathion_feed_blue_i00"/>
		<set name="reuseDelay" value="60000"/>
		<set name="coolTime" value="500"/>
		<set name="target" value="TARGET_NONE"/>
		<set name="skillType" value="NOTUSED"/>
		<set name="operate_type" value="P"/>
	</skill>
	<skill id="56007" levels="1" name="Shining Fishing Box">
		<set name="icon" value="icon.skill0000"/>
		<set name="coolTime" value="500"/>
		<set name="hitTime" value="500"/>
		<set name="target" value="TARGET_NONE"/>
		<set name="skillType" value="NOTUSED"/>
		<set name="operate_type" value="P"/>
	</skill>
	<skill id="56008" levels="1" name="Fishing XP Scroll">
		<set name="icon" value="icon.skill0000"/>
		<set name="reuseDelay" value="5000"/>
		<set name="target" value="TARGET_NONE"/>
		<set name="skillType" value="NOTUSED"/>
		<set name="operate_type" value="P"/>
	</skill>
	<skill id="56009" levels="11" name="Mermaid Agathion Unique Ability">
		<set name="icon" value="icon.agathion_base"/>
		<set name="target" value="TARGET_NONE"/>
		<set name="skillType" value="NOTUSED"/>
		<set name="operate_type" value="P"/>
	</skill>
	<skill id="56010" levels="4" name="Mermaid\'s Blessing">
		<set name="effectPoint" value="379"/>
		<set name="icon" value="icon.skill_agathion_special"/>
		<set name="reuseDelay" value="3600000"/>
		<set name="hitTime" value="1000"/>
		<set name="target" value="TARGET_NONE"/>
		<set name="skillType" value="NOTUSED"/>
		<set name="operate_type" value="P"/>
	</skill>
	<skill id="56011" levels="1" name="Complete Arms Supplies Pack">
		<set name="icon" value="icon.skill0000"/>
		<set name="coolTime" value="500"/>
		<set name="hitTime" value="500"/>
		<set name="target" value="TARGET_NONE"/>
		<set name="skillType" value="NOTUSED"/>
		<set name="operate_type" value="P"/>
	</skill>
	<skill id="56019" levels="1" name="+7 Elmoreden Cloak Box">
		<set name="icon" value="icon.skill0000"/>
		<set name="reuseDelay" value="3000"/>
		<set name="target" value="TARGET_NONE"/>
		<set name="skillType" value="NOTUSED"/>
		<set name="operate_type" value="P"/>
	</skill>
	<skill id="56020" levels="1" name="+7 Aden Cloak Box">
		<set name="icon" value="icon.skill0000"/>
		<set name="reuseDelay" value="3000"/>
		<set name="target" value="TARGET_NONE"/>
		<set name="skillType" value="NOTUSED"/>
		<set name="operate_type" value="P"/>
	</skill>
	<skill id="56021" levels="1" name="+7 Elmore Cloak Box">
		<set name="icon" value="icon.skill0000"/>
		<set name="reuseDelay" value="3000"/>
		<set name="target" value="TARGET_NONE"/>
		<set name="skillType" value="NOTUSED"/>
		<set name="operate_type" value="P"/>
	</skill>
	<skill id="56022" levels="1" name="+7 Ferios Cloak Box">
		<set name="icon" value="icon.skill0000"/>
		<set name="reuseDelay" value="3000"/>
		<set name="target" value="TARGET_NONE"/>
		<set name="skillType" value="NOTUSED"/>
		<set name="operate_type" value="P"/>
	</skill>
</list>