<?xml version="1.0" encoding="UTF-8"?>
<!DOCTYPE list SYSTEM "skill.dtd">
<list>
	<skill id="14765" levels="5" name="Blood Siphon Resistance">
		<set name="icon" value="icon.skillraid"/>
		<set name="target" value="TARGET_NONE"/>
		<set name="skillType" value="NOTUSED"/>
		<set name="operate_type" value="P"/>
	</skill>
	<skill id="14767" levels="1" name="Siege Punch">
		<set name="effectPoint" value="-100"/>
		<set name="icon" value="icon.skill0000"/>
		<set name="reuseDelay" value="5000"/>
		<set name="hitTime" value="4600"/>
		<set name="magicLevel" value="85"/>
		<set name="affect_range" value="600"/>
		<set name="target" value="TARGET_AURA"/>
		<set name="skillType" value="PDAM"/>
		<set name="operate_type" value="A2"/>
		<set name="power" value="31500"/>
	</skill>
</list>