<?xml version="1.0" encoding="UTF-8"?>
<!DOCTYPE list SYSTEM "skill.dtd">
<list>
	<skill id="21109" levels="1" name="Summon Agathion - Uthanka">
		<set name="icon" value="icon.etc_summon_aga_agit_i00"/>
		<set name="hitTime" value="3000"/>
		<set name="ride_state" value="NONE;STRIDER;WYVERN;WOLF"/>
		<set name="magicLevel" value="85"/>
		<set name="magicType" value="SPECIAL"/>
		<set name="target" value="TARGET_SELF"/>
		<set name="skillType" value="BUFF"/>
		<set name="operate_type" value="A2"/>
		<set name="isReuseDelayPermanent" value="true"/>
		<set name="useSS" value="false"/>
		<for>
			<effect name="i_summon_agathion" value="533"/>
		</for>
	</skill>
</list>