<?xml version="1.0" encoding="UTF-8"?>
<!DOCTYPE list SYSTEM "skill.dtd">
<list>
	<skill id="23174" levels="1" name="Life Hazard">
		<set name="effectPoint" value="1"/>
		<set name="icon" value="icon.skill_agathion_special"/>
		<set name="reuseDelay" value="43200000"/>
		<set name="castRange" value="600"/>
		<set name="hitTime" value="3000"/>
		<set name="target" value="TARGET_NONE"/>
		<set name="skillType" value="NOTUSED"/>
		<set name="operate_type" value="P"/>
	</skill>
</list>